{
  "schema_version": "concurrency-conformance.v2",
  "profile": {
    "subject_id": "urn:delta-atlas:subject:synthetic-concurrency",
    "policy_id": "urn:delta-atlas:policy:concurrency-candidate",
    "policy_generation": 1,
    "causal_frontier": ["urn:delta-atlas:event:base-0"],
    "limits": {
      "budget_used": 100,
      "capacity_unit": "consequence-unit",
      "buffers": { "observation": 6, "settlement": 6, "recovery": 6 }
    },
    "effect_policy": { "dedupe_retention_steps": 3 }
  },
  "batch_cases": [
    {
      "case_id": "disjoint-writes-commute",
      "termination_evidence": "FINITE_ENUMERATION",
      "base_state": { "values": {} },
      "deltas": [
        {
          "delta_id": "delta-a",
          "subject_id": "urn:delta-atlas:subject:synthetic-concurrency",
          "policy_id": "urn:delta-atlas:policy:concurrency-candidate",
          "policy_generation": 1,
          "causal_parents": ["urn:delta-atlas:event:base-0"],
          "reads": [], "predicate_reads": [], "writes": { "flag.alpha": true }, "increments": {}, "effects": []
        },
        {
          "delta_id": "delta-b",
          "subject_id": "urn:delta-atlas:subject:synthetic-concurrency",
          "policy_id": "urn:delta-atlas:policy:concurrency-candidate",
          "policy_generation": 1,
          "causal_parents": ["urn:delta-atlas:event:base-0"],
          "reads": [], "predicate_reads": [], "writes": { "flag.beta": true }, "increments": {}, "effects": []
        }
      ],
      "expected": { "status": "PASS", "reason_code": "COMMUTES", "schedule_count": 2, "pairwise_all_commute": true }
    },
    {
      "case_id": "same-key-order-required",
      "termination_evidence": "FINITE_ENUMERATION",
      "base_state": { "values": {} },
      "deltas": [
        {
          "delta_id": "delta-a",
          "subject_id": "urn:delta-atlas:subject:synthetic-concurrency",
          "policy_id": "urn:delta-atlas:policy:concurrency-candidate",
          "policy_generation": 1,
          "causal_parents": ["urn:delta-atlas:event:base-0"],
          "reads": ["mode"], "predicate_reads": [], "writes": { "mode": "A" }, "increments": {}, "effects": []
        },
        {
          "delta_id": "delta-b",
          "subject_id": "urn:delta-atlas:subject:synthetic-concurrency",
          "policy_id": "urn:delta-atlas:policy:concurrency-candidate",
          "policy_generation": 1,
          "causal_parents": ["urn:delta-atlas:event:base-0"],
          "reads": ["mode"], "predicate_reads": [], "writes": { "mode": "B" }, "increments": {}, "effects": []
        }
      ],
      "expected": { "status": "FAIL", "reason_code": "ORDER_REQUIRED", "schedule_count": 2, "pairwise_all_commute": false }
    },
    {
      "case_id": "triple-budget-pairwise-insufficient",
      "termination_evidence": "FINITE_ENUMERATION",
      "base_state": { "values": { "budget_used": 0 } },
      "deltas": [
        {
          "delta_id": "alloc-a",
          "subject_id": "urn:delta-atlas:subject:synthetic-concurrency",
          "policy_id": "urn:delta-atlas:policy:concurrency-candidate",
          "policy_generation": 1,
          "causal_parents": ["urn:delta-atlas:event:base-0"],
          "reads": ["budget_used"], "predicate_reads": [{ "field": "budget_used", "operator": "LTE", "value": 60 }], "writes": {}, "increments": { "budget_used": 40 }, "effects": []
        },
        {
          "delta_id": "alloc-b",
          "subject_id": "urn:delta-atlas:subject:synthetic-concurrency",
          "policy_id": "urn:delta-atlas:policy:concurrency-candidate",
          "policy_generation": 1,
          "causal_parents": ["urn:delta-atlas:event:base-0"],
          "reads": ["budget_used"], "predicate_reads": [{ "field": "budget_used", "operator": "LTE", "value": 60 }], "writes": {}, "increments": { "budget_used": 40 }, "effects": []
        },
        {
          "delta_id": "alloc-c",
          "subject_id": "urn:delta-atlas:subject:synthetic-concurrency",
          "policy_id": "urn:delta-atlas:policy:concurrency-candidate",
          "policy_generation": 1,
          "causal_parents": ["urn:delta-atlas:event:base-0"],
          "reads": ["budget_used"], "predicate_reads": [{ "field": "budget_used", "operator": "LTE", "value": 60 }], "writes": {}, "increments": { "budget_used": 40 }, "effects": []
        }
      ],
      "expected": { "status": "FAIL", "reason_code": "PAIRWISE_INSUFFICIENT", "schedule_count": 6, "pairwise_all_commute": true }
    },
    {
      "case_id": "same-projection-different-effects",
      "termination_evidence": "FINITE_ENUMERATION",
      "base_state": { "values": {} },
      "deltas": [
        {
          "delta_id": "effect-a",
          "subject_id": "urn:delta-atlas:subject:synthetic-concurrency",
          "policy_id": "urn:delta-atlas:policy:concurrency-candidate",
          "policy_generation": 1,
          "causal_parents": ["urn:delta-atlas:event:base-0"],
          "reads": [], "predicate_reads": [], "writes": {}, "increments": {},
          "effects": [{ "effect_id": "send-a", "idempotency_key": "key-a" }]
        },
        {
          "delta_id": "effect-b",
          "subject_id": "urn:delta-atlas:subject:synthetic-concurrency",
          "policy_id": "urn:delta-atlas:policy:concurrency-candidate",
          "policy_generation": 1,
          "causal_parents": ["urn:delta-atlas:event:base-0"],
          "reads": [], "predicate_reads": [], "writes": {}, "increments": {},
          "effects": [{ "effect_id": "send-b", "idempotency_key": "key-b" }]
        }
      ],
      "expected": { "status": "FAIL", "reason_code": "EFFECT_ORDER_REQUIRED", "schedule_count": 2, "pairwise_all_commute": false }
    },
    {
      "case_id": "reject-failed-precondition",
      "termination_evidence": "FINITE_ENUMERATION",
      "base_state": { "values": { "armed": false } },
      "deltas": [
        {
          "delta_id": "delta-guarded",
          "subject_id": "urn:delta-atlas:subject:synthetic-concurrency",
          "policy_id": "urn:delta-atlas:policy:concurrency-candidate",
          "policy_generation": 1,
          "causal_parents": ["urn:delta-atlas:event:base-0"],
          "reads": ["armed"],
          "predicate_reads": [{ "field": "armed", "operator": "EQ", "value": true }],
          "writes": { "launched": true },
          "increments": {},
          "effects": []
        }
      ],
      "expected": { "status": "FAIL", "reason_code": "PRECONDITION_FAILED", "schedule_count": 0, "pairwise_all_commute": false }
    },
    {
      "case_id": "broken-causal-frontier",
      "termination_evidence": "FINITE_ENUMERATION",
      "base_state": { "values": {} },
      "deltas": [
        {
          "delta_id": "delta-orphan",
          "subject_id": "urn:delta-atlas:subject:synthetic-concurrency",
          "policy_id": "urn:delta-atlas:policy:concurrency-candidate",
          "policy_generation": 1,
          "causal_parents": ["urn:delta-atlas:event:missing"],
          "reads": [], "predicate_reads": [], "writes": { "flag": true }, "increments": {}, "effects": []
        }
      ],
      "expected": { "status": "FAIL", "reason_code": "CAUSAL_FRONTIER_MISMATCH", "schedule_count": 0, "pairwise_all_commute": false }
    },
    {
      "case_id": "policy-generation-mismatch",
      "termination_evidence": "FINITE_ENUMERATION",
      "base_state": { "values": {} },
      "deltas": [
        {
          "delta_id": "delta-stale-policy",
          "subject_id": "urn:delta-atlas:subject:synthetic-concurrency",
          "policy_id": "urn:delta-atlas:policy:concurrency-candidate",
          "policy_generation": 2,
          "causal_parents": ["urn:delta-atlas:event:base-0"],
          "reads": [], "predicate_reads": [], "writes": { "flag": true }, "increments": {}, "effects": []
        }
      ],
      "expected": { "status": "FAIL", "reason_code": "POLICY_BINDING_MISMATCH", "schedule_count": 0, "pairwise_all_commute": false }
    },
    {
      "case_id": "nonterminating-rebase-not-proven",
      "termination_evidence": "ABSENT",
      "base_state": { "values": {} },
      "deltas": [
        {
          "delta_id": "delta-loop",
          "subject_id": "urn:delta-atlas:subject:synthetic-concurrency",
          "policy_id": "urn:delta-atlas:policy:concurrency-candidate",
          "policy_generation": 1,
          "causal_parents": ["urn:delta-atlas:event:base-0"],
          "reads": [], "predicate_reads": [], "writes": {}, "increments": {}, "effects": []
        }
      ],
      "expected": { "status": "UNKNOWN", "reason_code": "TERMINATION_NOT_PROVEN", "schedule_count": 0, "pairwise_all_commute": false }
    }
  ],
  "effect_cases": [
    {
      "case_id": "effect-settled",
      "events": [
        { "sequence": 1, "previous_sequence": null, "effect_step": 1, "type": "PREPARE", "effect_id": "effect-1", "idempotency_key": "key-1", "policy_generation": 1 },
        { "sequence": 2, "previous_sequence": 1, "effect_step": 2, "type": "DISPATCH", "effect_id": "effect-1", "idempotency_key": "key-1", "policy_generation": 1 },
        { "sequence": 3, "previous_sequence": 2, "effect_step": 3, "type": "OBSERVE", "effect_id": "effect-1", "idempotency_key": "key-1", "policy_generation": 1, "outcome": "SUCCEEDED" },
        { "sequence": 4, "previous_sequence": 3, "effect_step": 4, "type": "SETTLE", "effect_id": "effect-1", "idempotency_key": "key-1", "policy_generation": 1 }
      ],
      "expected": { "status": "PASS", "reason_code": "SETTLED", "effect_count": 1 }
    },
    {
      "case_id": "timeout-after-dispatch",
      "events": [
        { "sequence": 1, "previous_sequence": null, "effect_step": 1, "type": "PREPARE", "effect_id": "effect-2", "idempotency_key": "key-2", "policy_generation": 1 },
        { "sequence": 2, "previous_sequence": 1, "effect_step": 2, "type": "DISPATCH", "effect_id": "effect-2", "idempotency_key": "key-2", "policy_generation": 1 },